<?xml version="1.0" encoding="UTF-8"?>
<!DOCTYPE modules PUBLIC
  "-//Penrose/DTD Modules ${product.specification}//EN"
  "http://penrose.safehaus.org/dtd/modules.dtd">

<modules>

  <module name="ChangeLogMonitorModule">
    <module-class>org.safehaus.penrose.ipa.module.ChangeLogMonitorModule</module-class>
    <parameter>
      <param-name>source</param-name>
      <param-value>ipa</param-value>
    </parameter>
    <parameter>
      <param-name>sourceUsers</param-name>
      <param-value>ipa_users</param-value>
    </parameter>
    <parameter>
      <param-name>sourceGroups</param-name>
      <param-value>ipa_groups</param-value>
    </parameter>
    <parameter>
      <param-name>sourceHosts</param-name>
      <param-value>ipa_hosts</param-value>
    </parameter>
    <parameter>
      <param-name>target</param-name>
      <param-value>sambaBE</param-value>
    </parameter>
    <parameter>
      <param-name>targetWrite</param-name>
      <param-value>sambaFE</param-value>
    </parameter>
    <parameter>
      <param-name>targetUsers</param-name>
      <param-value>sambaUsersBE</param-value>
    </parameter>
    <parameter>
      <param-name>targetGroups</param-name>
      <param-value>sambaGroupsBE</param-value>
    </parameter>
    <parameter>
      <param-name>targetHosts</param-name>
      <param-value>sambaHosts</param-value>
    </parameter>
    <parameter>
      <param-name>changelog</param-name>
      <param-value>ipa_changelog</param-value>
    </parameter>
    <parameter>
      <param-name>tracker</param-name>
      <param-value>ipa_tracker</param-value>
    </parameter>
    <parameter>
      <param-name>userSyncModule</param-name>
      <param-value>IPASambaUserModule</param-value>
    </parameter>
    <parameter>
      <param-name>groupSyncModule</param-name>
      <param-value>IPASambaGroupModule</param-value>
    </parameter>
  </module>

</modules>
