<?xml version="1.0" encoding="UTF-8"?>
<!DOCTYPE modules PUBLIC
  "-//Penrose/DTD Modules ${product.specification}//EN"
  "http://penrose.safehaus.org/dtd/modules.dtd">

<modules>

  <module name="SambaIPAUserModule">
    <module-class>org.safehaus.penrose.samba.module.SambaIPAUserSyncModule</module-class>
    <parameter>
      <param-name>source</param-name>
      <param-value>samba</param-value>
    </parameter>
    <parameter>
      <param-name>sourceUsers</param-name>
      <param-value>samba_users</param-value>
    </parameter>
    <parameter>
      <param-name>sourceKeyAttribute</param-name>
      <param-value>sAMAccountName</param-value>
    </parameter>
    <parameter>
      <param-name>sourceLinkAttribute</param-name>
      <param-value>nsUniqueId</param-value>
    </parameter>
    <parameter>
      <param-name>importSourceUserMapping</param-name>
      <param-value>ImportSambaUser</param-value>
    </parameter>
    <parameter>
      <param-name>linkTargetUserMapping</param-name>
      <param-value>LinkIPAUser</param-value>
    </parameter>
    <parameter>
      <param-name>linkSourceUserMapping</param-name>
      <param-value>LinkSambaUser</param-value>
    </parameter>
    <parameter>
      <param-name>syncSourceUserMapping</param-name>
      <param-value>SyncSambaUser</param-value>
    </parameter>
    <parameter>
      <param-name>unlinkTargetUserMapping</param-name>
      <param-value>UnlinkIPAUser</param-value>
    </parameter>
    <parameter>
      <param-name>target</param-name>
      <param-value>ipa</param-value>
    </parameter>
    <parameter>
      <param-name>targetUsers</param-name>
      <param-value>ipaUsers</param-value>
    </parameter>
    <parameter>
      <param-name>targetKeyAttribute</param-name>
      <param-value>uid</param-value>
    </parameter>
    <parameter>
      <param-name>targetLinkAttribute</param-name>
      <param-value>ntUniqueId</param-value>
    </parameter>
    <parameter>
      <param-name>ignoreDn.count</param-name>
      <param-value>1</param-value>
    </parameter>
    <parameter>
      <param-name>ignoreDn.1</param-name>
      <param-value>CN=Sync,CN=Users,DC=example,DC=com</param-value>
    </parameter>
  </module>

  <module name="SambaIPAGroupModule">
    <module-class>org.safehaus.penrose.ipa.module.GroupSyncModule</module-class>
    <parameter>
      <param-name>source</param-name>
      <param-value>samba</param-value>
    </parameter>
    <parameter>
      <param-name>sourceUsers</param-name>
      <param-value>samba_users</param-value>
    </parameter>
    <parameter>
      <param-name>sourceGroups</param-name>
      <param-value>samba_groups</param-value>
    </parameter>
    <parameter>
      <param-name>sourceKeyAttribute</param-name>
      <param-value>sAMAccountName</param-value>
    </parameter>
    <parameter>
      <param-name>sourceLinkAttribute</param-name>
      <param-value>objectGUID</param-value>
    </parameter>
    <parameter>
      <param-name>importSourceGroupMapping</param-name>
      <param-value>ImportSambaGroup</param-value>
    </parameter>
    <parameter>
      <param-name>syncSourceGroupMapping</param-name>
      <param-value>SyncSambaGroup</param-value>
    </parameter>
    <parameter>
      <param-name>unlinkSourceGroupMapping</param-name>
      <param-value>UnlinkSambaGroup</param-value>
    </parameter>
    <parameter>
      <param-name>target</param-name>
      <param-value>ipa</param-value>
    </parameter>
    <parameter>
      <param-name>targetGroups</param-name>
      <param-value>ipa_groups</param-value>
    </parameter>
    <parameter>
      <param-name>targetKeyAttribute</param-name>
      <param-value>cn</param-value>
    </parameter>
    <parameter>
      <param-name>targetLinkAttribute</param-name>
      <param-value>objectGUID</param-value>
    </parameter>
    <parameter>
      <param-name>userSyncModule</param-name>
      <param-value>SambaIPAUserModule</param-value>
    </parameter>
  </module>

  <module name="SambaChangeLogMonitorModule">
    <module-class>org.safehaus.penrose.ipa.module.ChangeLogMonitorModule</module-class>
    <parameter>
      <param-name>source</param-name>
      <param-value>samba</param-value>
    </parameter>
    <parameter>
      <param-name>sourceUsers</param-name>
      <param-value>samba_users</param-value>
    </parameter>
    <parameter>
      <param-name>sourceGroups</param-name>
      <param-value>samba_groups</param-value>
    </parameter>
    <parameter>
      <param-name>sourceHosts</param-name>
      <param-value>samba_hosts</param-value>
    </parameter>
    <parameter>
      <param-name>target</param-name>
      <param-value>ipa</param-value>
    </parameter>
    <parameter>
      <param-name>targetUsers</param-name>
      <param-value>ipa_users</param-value>
    </parameter>
    <parameter>
      <param-name>targetGroups</param-name>
      <param-value>ipa_groups</param-value>
    </parameter>
    <parameter>
      <param-name>targetHosts</param-name>
      <param-value>ipa_hosts</param-value>
    </parameter>
    <parameter>
      <param-name>changelog</param-name>
      <param-value>samba_changelog</param-value>
    </parameter>
    <parameter>
      <param-name>tracker</param-name>
      <param-value>samba_tracker</param-value>
    </parameter>
    <parameter>
      <param-name>userSyncModule</param-name>
      <param-value>SambaIPAUserModule</param-value>
    </parameter>
    <parameter>
      <param-name>groupSyncModule</param-name>
      <param-value>SambaIPAGroupModule</param-value>
    </parameter>
  </module>

</modules>
