<?xml version="1.0" encoding="UTF-8"?>
<!DOCTYPE modules PUBLIC
  "-//Penrose/DTD Modules ${product.specification}//EN"
  "http://penrose.safehaus.org/dtd/modules.dtd">

<modules>

  <module name="IPASambaGroupModule">
    <module-class>org.safehaus.penrose.ipa.module.GroupSyncModule</module-class>
    <parameter>
      <param-name>source</param-name>
      <param-value>ipa</param-value>
    </parameter>
    <parameter>
      <param-name>sourceUsers</param-name>
      <param-value>ipa_users</param-value>
    </parameter>
    <parameter>
      <param-name>sourceGroups</param-name>
      <param-value>ipa_groups</param-value>
    </parameter>
    <parameter>
      <param-name>sourceKeyAttribute</param-name>
      <param-value>cn</param-value>
    </parameter>
    <parameter>
      <param-name>sourceLinkAttribute</param-name>
      <param-value>ntUniqueId</param-value>
    </parameter>
    <parameter>
      <param-name>targetImportGroupMapping</param-name>
      <param-value>SambaImportGroup</param-value>
    </parameter>
    <parameter>
      <param-name>sourceImportGroupMapping</param-name>
      <param-value>IPAImportGroup</param-value>
    </parameter>
    <parameter>
      <param-name>targetLinkGroupMapping</param-name>
      <param-value>SambaLinkGroup</param-value>
    </parameter>
    <parameter>
      <param-name>sourceLinkGroupMapping</param-name>
      <param-value>IPALinkGroup</param-value>
    </parameter>
    <parameter>
      <param-name>targetSyncGroupMapping</param-name>
      <param-value>SambaSyncGroup</param-value>
    </parameter>
    <parameter>
      <param-name>sourceSyncGroupMapping</param-name>
      <param-value>IPASyncGroup</param-value>
    </parameter>
    <parameter>
      <param-name>targetUnlinkGroupMapping</param-name>
      <param-value>SambaUnlinkGroup</param-value>
    </parameter>
    <parameter>
      <param-name>sourceUnlinkGroupMapping</param-name>
      <param-value>IPAUnlinkGroup</param-value>
    </parameter>
    <parameter>
      <param-name>targetAlias</param-name>
      <param-value>samba</param-value>
    </parameter>
    <parameter>
      <param-name>target</param-name>
      <param-value>sambaFE</param-value>
    </parameter>
    <parameter>
      <param-name>targetGroups</param-name>
      <param-value>sambaGroupsBE</param-value>
    </parameter>
    <parameter>
      <param-name>targetKeyAttribute</param-name>
      <param-value>sAMAccountName</param-value>
    </parameter>
    <parameter>
      <param-name>targetLinkAttribute</param-name>
      <param-value>nsUniqueId</param-value>
    </parameter>
    <parameter>
      <param-name>userSyncModule</param-name>
      <param-value>IPASambaUserModule</param-value>
    </parameter>
  </module>

</modules>
