<?xml version="1.0" encoding="UTF-8"?>
<!DOCTYPE modules PUBLIC
  "-//Penrose/DTD Modules ${product.specification}//EN"
  "http://penrose.safehaus.org/dtd/modules.dtd">

<modules>

  <module name="SambaIPAUserModule">
    <module-class>org.safehaus.penrose.samba.module.SambaIPAUserSyncModule</module-class>
    <parameter>
      <param-name>source</param-name>
      <param-value>samba</param-value>
    </parameter>
    <parameter>
      <param-name>sourceUsers</param-name>
      <param-value>sambaUsers</param-value>
    </parameter>
    <parameter>
      <param-name>sourceKeyAttribute</param-name>
      <param-value>sAMAccountName</param-value>
    </parameter>
    <parameter>
      <param-name>sourceLinkAttribute</param-name>
      <param-value>nsUniqueId</param-value>
    </parameter>
    <parameter>
      <param-name>targetImportUserMapping</param-name>
      <param-value>IPAImportUser</param-value>
    </parameter>
    <parameter>
      <param-name>targetLinkUserMapping</param-name>
      <param-value>IPALinkUser</param-value>
    </parameter>
    <parameter>
      <param-name>sourceLinkUserMapping</param-name>
      <param-value>SambaLinkUser</param-value>
    </parameter>
    <parameter>
      <param-name>targetSyncUserMapping</param-name>
      <param-value>IPASyncUser</param-value>
    </parameter>
    <parameter>
      <param-name>targetUnlinkUserMapping</param-name>
      <param-value>IPAUnlinkUser</param-value>
    </parameter>
    <parameter>
      <param-name>target</param-name>
      <param-value>ipa</param-value>
    </parameter>
    <parameter>
      <param-name>targetUsers</param-name>
      <param-value>ipaUsers</param-value>
    </parameter>
    <parameter>
      <param-name>targetKeyAttribute</param-name>
      <param-value>uid</param-value>
    </parameter>
    <parameter>
      <param-name>targetLinkAttribute</param-name>
      <param-value>ntUniqueId</param-value>
    </parameter>
    <parameter>
      <param-name>ignoreDn.count</param-name>
      <param-value>1</param-value>
    </parameter>
    <parameter>
      <param-name>ignoreDn.1</param-name>
      <param-value>CN=Sync,CN=Users,DC=example,DC=com</param-value>
    </parameter>
  </module>

</modules>
