<?xml version="1.0" encoding="UTF-8"?>
<!DOCTYPE modules PUBLIC
  "-//Penrose/DTD Modules ${product.specification}//EN"
  "http://penrose.safehaus.org/dtd/modules.dtd">

<modules>

  <module name="DemoModule">
    <module-class>org.safehaus.penrose.example.module.DemoModule</module-class>
  </module>

  <module-mapping>
    <module-name>DemoModule</module-name>
    <base-dn>ou=Users,dc=Module,dc=Example,dc=com</base-dn>
    <filter>(objectClass=*)</filter>
    <scope>SUBTREE</scope>
  </module-mapping>

</modules>
