<?xml version="1.0" encoding="UTF-8"?>
<!DOCTYPE modules PUBLIC
  "-//Penrose/DTD Modules ${product.specification}//EN"
  "http://penrose.safehaus.org/dtd/modules.dtd">

<modules>

  <module name="IPASambaUserModule">
    <module-class>org.safehaus.penrose.ipa.module.IPASambaUserSyncModule</module-class>
    <parameter>
      <param-name>source</param-name>
      <param-value>ipa</param-value>
    </parameter>
    <parameter>
      <param-name>sourceUsers</param-name>
      <param-value>ipa_users</param-value>
    </parameter>
    <parameter>
      <param-name>sourceKeyAttribute</param-name>
      <param-value>uid</param-value>
    </parameter>
    <parameter>
      <param-name>sourceLinkAttribute</param-name>
      <param-value>ntUniqueId</param-value>
    </parameter>
    <parameter>
      <param-name>targetImportUserMapping</param-name>
      <param-value>SambaImportUser</param-value>
    </parameter>
    <parameter>
      <param-name>sourceImportUserMapping</param-name>
      <param-value>IPAImportUser</param-value>
    </parameter>
    <parameter>
      <param-name>targetLinkUserMapping</param-name>
      <param-value>SambaLinkUser</param-value>
    </parameter>
    <parameter>
      <param-name>sourceLinkUserMapping</param-name>
      <param-value>IPALinkUser</param-value>
    </parameter>
    <parameter>
      <param-name>targetSyncUserMapping</param-name>
      <param-value>SambaSyncUser</param-value>
    </parameter>
    <parameter>
      <param-name>targetUnlinkUserMapping</param-name>
      <param-value>SambaUnlinkUser</param-value>
    </parameter>
    <parameter>
      <param-name>sourceUnlinkUserMapping</param-name>
      <param-value>IPAUnlinkUser</param-value>
    </parameter>
    <parameter>
      <param-name>targetAlias</param-name>
      <param-value>samba</param-value>
    </parameter>
    <parameter>
      <param-name>target</param-name>
      <param-value>sambaFE</param-value>
    </parameter>
    <parameter>
      <param-name>targetUsersFE</param-name>
      <param-value>sambaUsersFE</param-value>
    </parameter>
    <parameter>
      <param-name>targetUsersBE</param-name>
      <param-value>sambaUsersBE</param-value>
    </parameter>
    <parameter>
      <param-name>targetKeyAttribute</param-name>
      <param-value>sAMAccountName</param-value>
    </parameter>
    <parameter>
      <param-name>targetLinkAttribute</param-name>
      <param-value>nsUniqueId</param-value>
    </parameter>
  </module>

  <module name="IPASambaGroupModule">
    <module-class>org.safehaus.penrose.ipa.module.GroupSyncModule</module-class>
    <parameter>
      <param-name>source</param-name>
      <param-value>ipa</param-value>
    </parameter>
    <parameter>
      <param-name>sourceUsers</param-name>
      <param-value>ipa_users</param-value>
    </parameter>
    <parameter>
      <param-name>sourceGroups</param-name>
      <param-value>ipa_groups</param-value>
    </parameter>
    <parameter>
      <param-name>sourceKeyAttribute</param-name>
      <param-value>cn</param-value>
    </parameter>
    <parameter>
      <param-name>sourceLinkAttribute</param-name>
      <param-value>ntUniqueId</param-value>
    </parameter>
    <parameter>
      <param-name>importSourceGroupMapping</param-name>
      <param-value>ImportIPAGroup</param-value>
    </parameter>
    <parameter>
      <param-name>importTargetGroupMapping</param-name>
      <param-value>ImportSambaGroup</param-value>
    </parameter>
    <parameter>
      <param-name>linkSourceGroupMapping</param-name>
      <param-value>LinkIPAGroup</param-value>
    </parameter>
    <parameter>
      <param-name>linkTargetGroupMapping</param-name>
      <param-value>LinkSambaGroup</param-value>
    </parameter>
    <parameter>
      <param-name>syncSourceGroupMapping</param-name>
      <param-value>SyncIPAGroup</param-value>
    </parameter>
    <parameter>
      <param-name>syncTargetGroupMapping</param-name>
      <param-value>SyncSambaGroup</param-value>
    </parameter>
    <parameter>
      <param-name>unlinkSourceGroupMapping</param-name>
      <param-value>UnlinkIPAGroup</param-value>
    </parameter>
    <parameter>
      <param-name>unlinkTargetGroupMapping</param-name>
      <param-value>UnlinkSambaGroup</param-value>
    </parameter>
    <parameter>
      <param-name>targetAlias</param-name>
      <param-value>samba</param-value>
    </parameter>
    <parameter>
      <param-name>target</param-name>
      <param-value>sambaFE</param-value>
    </parameter>
    <parameter>
      <param-name>targetGroups</param-name>
      <param-value>sambaGroupsBE</param-value>
    </parameter>
    <parameter>
      <param-name>targetKeyAttribute</param-name>
      <param-value>sAMAccountName</param-value>
    </parameter>
    <parameter>
      <param-name>targetLinkAttribute</param-name>
      <param-value>nsUniqueId</param-value>
    </parameter>
    <parameter>
      <param-name>userSyncModule</param-name>
      <param-value>IPASambaUserModule</param-value>
    </parameter>
  </module>

  <module name="ChangeLogMonitorModule">
    <module-class>org.safehaus.penrose.ipa.module.ChangeLogMonitorModule</module-class>
    <parameter>
      <param-name>source</param-name>
      <param-value>ipa</param-value>
    </parameter>
    <parameter>
      <param-name>sourceUsers</param-name>
      <param-value>ipa_users</param-value>
    </parameter>
    <parameter>
      <param-name>sourceGroups</param-name>
      <param-value>ipa_groups</param-value>
    </parameter>
    <parameter>
      <param-name>sourceHosts</param-name>
      <param-value>ipa_hosts</param-value>
    </parameter>
    <parameter>
      <param-name>target</param-name>
      <param-value>sambaBE</param-value>
    </parameter>
    <parameter>
      <param-name>targetWrite</param-name>
      <param-value>sambaFE</param-value>
    </parameter>
    <parameter>
      <param-name>targetUsers</param-name>
      <param-value>sambaUsersBE</param-value>
    </parameter>
    <parameter>
      <param-name>targetGroups</param-name>
      <param-value>sambaGroupsBE</param-value>
    </parameter>
    <parameter>
      <param-name>targetHosts</param-name>
      <param-value>sambaHosts</param-value>
    </parameter>
    <parameter>
      <param-name>changelog</param-name>
      <param-value>ipa_changelog</param-value>
    </parameter>
    <parameter>
      <param-name>tracker</param-name>
      <param-value>ipa_tracker</param-value>
    </parameter>
    <parameter>
      <param-name>userSyncModule</param-name>
      <param-value>IPASambaUserModule</param-value>
    </parameter>
    <parameter>
      <param-name>groupSyncModule</param-name>
      <param-value>IPASambaGroupModule</param-value>
    </parameter>
  </module>

</modules>
