<?xml version="1.0" encoding="UTF-8"?>
<!DOCTYPE modules PUBLIC
  "-//Penrose/DTD Modules ${product.specification}//EN"
  "http://penrose.safehaus.org/dtd/modules.dtd">

<modules>

  <module name="users">
    <module-class>org.safehaus.penrose.ad.module.ADSyncModule</module-class>
    <parameter>
      <param-name>source</param-name>
      <param-value>users</param-value>
    </parameter>
    <parameter>
      <param-name>target</param-name>
      <param-value>users_cache</param-value>
    </parameter>
    <parameter>
      <param-name>baseDn</param-name>
      <param-value>dc=Example,dc=com</param-value>
    </parameter>
    <parameter>
      <param-name>interval</param-name>
      <param-value>10</param-value>
    </parameter>
  </module>

  <module name="groups">
    <module-class>org.safehaus.penrose.ad.module.ADSyncModule</module-class>
    <parameter>
      <param-name>source</param-name>
      <param-value>groups</param-value>
    </parameter>
    <parameter>
      <param-name>target</param-name>
      <param-value>groups_cache</param-value>
    </parameter>
    <parameter>
      <param-name>baseDn</param-name>
      <param-value>dc=Example,dc=com</param-value>
    </parameter>
    <parameter>
      <param-name>interval</param-name>
      <param-value>10</param-value>
    </parameter>
  </module>

</modules>
