<?xml version="1.0" encoding="UTF-8"?>
<!DOCTYPE modules PUBLIC
  "-//Penrose/DTD Modules ${product.specification}//EN"
  "http://penrose.safehaus.org/dtd/modules.dtd">

<modules>

  <module name="SambaChangeLogMonitorModule">
    <module-class>org.safehaus.penrose.ipa.module.ChangeLogMonitorModule</module-class>
    <parameter>
      <param-name>source</param-name>
      <param-value>samba</param-value>
    </parameter>
    <parameter>
      <param-name>sourceUsers</param-name>
      <param-value>sambaUsers</param-value>
    </parameter>
    <parameter>
      <param-name>sourceGroups</param-name>
      <param-value>sambaGroups</param-value>
    </parameter>
    <parameter>
      <param-name>sourceHosts</param-name>
      <param-value>sambaHosts</param-value>
    </parameter>
    <parameter>
      <param-name>target</param-name>
      <param-value>ipa</param-value>
    </parameter>
    <parameter>
      <param-name>targetUsers</param-name>
      <param-value>ipaUsers</param-value>
    </parameter>
    <parameter>
      <param-name>targetGroups</param-name>
      <param-value>ipaGroups</param-value>
    </parameter>
    <parameter>
      <param-name>targetHosts</param-name>
      <param-value>ipaHosts</param-value>
    </parameter>
    <parameter>
      <param-name>changelog</param-name>
      <param-value>samba_changelog</param-value>
    </parameter>
    <parameter>
      <param-name>tracker</param-name>
      <param-value>samba_tracker</param-value>
    </parameter>
    <parameter>
      <param-name>userSyncModule</param-name>
      <param-value>SambaIPAUserModule</param-value>
    </parameter>
    <parameter>
      <param-name>groupSyncModule</param-name>
      <param-value>SambaIPAGroupModule</param-value>
    </parameter>
  </module>

</modules>
